{
  "evaluationKind": "DETERMINISTIC_OFFLINE_ZERO_TOKEN",
  "gate": {
    "allRelevantTestsPassed": true,
    "deterministicMatrixGreen": true,
    "failuresBoundedFailClosed": true,
    "humanMaterialsComplete": true,
    "mandatoryEvidenceRecallPreserved": true,
    "onTrackCheckpointTaxZero": true,
    "scopeV2Correct": true,
    "status": "PASS"
  },
  "humanAcceptance": {
    "checklistRef": "docs/roadmap/analysis-trajectory-guard/tg07-human-acceptance-checklist.md",
    "completed": false,
    "materialsComplete": true,
    "usefulnessConclusion": "NOT_ASSESSED_DETERMINISTICALLY"
  },
  "inputs": {
    "missionSeedHash": "sha256:ec22bfaa8f0f0e42cac67563320a68c003242ff8088f83e0a5e36e7d45a84fc3",
    "networkCalls": 0,
    "providerCalls": 0,
    "scopeV2PlanHash": "sha256:aa9f06b0a8c0b9695a0a475615eade4a7f41ae5ad84e7da406dc7139ddc6a8a0",
    "traceSetHash": "sha256:2b38b5cc719108dcf92111472ab0d5b1c21154c01d93684e2598bd84901d2dac",
    "traceSetRef": "fixture:tg00-traces-v1"
  },
  "livePilot": {
    "executed": false,
    "harnessRef": "scripts/analysis-trajectory-live-pilot.sh",
    "maximumRolloutWithoutLiveEvidence": "SHADOW_PILOT_ONLY",
    "providerCalls": 0,
    "reason": "No explicit live-pilot flag or preconfigured runtime-authorization assertion was supplied during TG07 execution."
  },
  "matrix": {
    "caseCount": 40,
    "cases": [
      {
        "actualTrajectoryOutcome": "NEEDS_OWNER_REVIEW",
        "caseId": "trace-architecture-rabbit-hole-001:enforce_failed_repair",
        "checkpointCount": 0,
        "downstreamScopeV2Result": {
          "basePlanCount": 1,
          "conditionalBranchCount": 7,
          "exclusiveAlternativeGroupCount": 3,
          "exclusiveAlternativesNotSummed": true,
          "finalCommittedEstimate": null,
          "relatedFindingCount": 3,
          "requiredEnablerCount": 3,
          "status": "NOT_REACHED_FAIL_CLOSED"
        },
        "evidenceCollectedRefs": [
          "EV-DELIVERY-AMBIGUITY"
        ],
        "expectedTrajectoryOutcome": "NEEDS_OWNER_REVIEW",
        "failureBehavior": "HALT_OWNER_REVIEW_NO_UNGUARDED_FALLBACK",
        "humanUsefulness": "NOT_ASSESSED_DETERMINISTICALLY",
        "irrelevantExplorationAvoidedRefs": [
          "action-architecture-rabbit-hole-2",
          "action-architecture-rabbit-hole-3"
        ],
        "mandatoryEvidenceExpectedRefs": [
          "EV-DELIVERY-AMBIGUITY"
        ],
        "mandatoryEvidencePreservedRefs": [
          "EV-DELIVERY-AMBIGUITY"
        ],
        "matchesExpected": true,
        "measurements": {
          "checkpointEnvelopeBytes": 0,
          "checkpointTokenProxy": 0,
          "ledgerBytes": 3716,
          "telemetryEventBytes": 1850,
          "tokenProxy": 1392,
          "tokens": {
            "availability": "UNAVAILABLE",
            "value": null
          },
          "wallTime": {
            "availability": "UNAVAILABLE",
            "value": null
          }
        },
        "providerCallDelta": -2,
        "providerCalls": 1,
        "scopeExpansionProposalRefs": [],
        "topology": "drift_from_open_decision",
        "traceId": "trace-architecture-rabbit-hole-001",
        "unresolvedGapRefs": [
          "GAP-AUTHZ-CHECK",
          "GAP-COMMIT-HOOK",
          "GAP-DELIVERY-GUARANTEE",
          "GAP-DEPENDENCY-CONTRACT",
          "GAP-RESULT-VISIBILITY"
        ],
        "variant": "ENFORCE_FAILED_REPAIR"
      },
      {
        "actualTrajectoryOutcome": "NEEDS_OWNER_REVIEW",
        "caseId": "trace-architecture-rabbit-hole-001:enforce_invalid_valid_repair",
        "checkpointCount": 0,
        "downstreamScopeV2Result": {
          "basePlanCount": 1,
          "conditionalBranchCount": 7,
          "exclusiveAlternativeGroupCount": 3,
          "exclusiveAlternativesNotSummed": true,
          "finalCommittedEstimate": null,
          "relatedFindingCount": 3,
          "requiredEnablerCount": 3,
          "status": "NOT_REACHED_FAIL_CLOSED"
        },
        "evidenceCollectedRefs": [
          "EV-DELIVERY-AMBIGUITY"
        ],
        "expectedTrajectoryOutcome": "NEEDS_OWNER_REVIEW",
        "failureBehavior": "HALT_OWNER_REVIEW_NO_UNGUARDED_FALLBACK",
        "humanUsefulness": "NOT_ASSESSED_DETERMINISTICALLY",
        "irrelevantExplorationAvoidedRefs": [
          "action-architecture-rabbit-hole-2",
          "action-architecture-rabbit-hole-3"
        ],
        "mandatoryEvidenceExpectedRefs": [
          "EV-DELIVERY-AMBIGUITY"
        ],
        "mandatoryEvidencePreservedRefs": [
          "EV-DELIVERY-AMBIGUITY"
        ],
        "matchesExpected": true,
        "measurements": {
          "checkpointEnvelopeBytes": 0,
          "checkpointTokenProxy": 0,
          "ledgerBytes": 3716,
          "telemetryEventBytes": 1850,
          "tokenProxy": 1392,
          "tokens": {
            "availability": "UNAVAILABLE",
            "value": null
          },
          "wallTime": {
            "availability": "UNAVAILABLE",
            "value": null
          }
        },
        "providerCallDelta": -2,
        "providerCalls": 1,
        "scopeExpansionProposalRefs": [],
        "topology": "drift_from_open_decision",
        "traceId": "trace-architecture-rabbit-hole-001",
        "unresolvedGapRefs": [
          "GAP-AUTHZ-CHECK",
          "GAP-COMMIT-HOOK",
          "GAP-DELIVERY-GUARANTEE",
          "GAP-DEPENDENCY-CONTRACT",
          "GAP-RESULT-VISIBILITY"
        ],
        "variant": "ENFORCE_INVALID_VALID_REPAIR"
      },
      {
        "actualTrajectoryOutcome": "NEEDS_OWNER_REVIEW",
        "caseId": "trace-architecture-rabbit-hole-001:enforce_valid",
        "checkpointCount": 0,
        "downstreamScopeV2Result": {
          "basePlanCount": 1,
          "conditionalBranchCount": 7,
          "exclusiveAlternativeGroupCount": 3,
          "exclusiveAlternativesNotSummed": true,
          "finalCommittedEstimate": null,
          "relatedFindingCount": 3,
          "requiredEnablerCount": 3,
          "status": "NOT_REACHED_FAIL_CLOSED"
        },
        "evidenceCollectedRefs": [
          "EV-DELIVERY-AMBIGUITY"
        ],
        "expectedTrajectoryOutcome": "NEEDS_OWNER_REVIEW",
        "failureBehavior": "HALT_OWNER_REVIEW_NO_UNGUARDED_FALLBACK",
        "humanUsefulness": "NOT_ASSESSED_DETERMINISTICALLY",
        "irrelevantExplorationAvoidedRefs": [
          "action-architecture-rabbit-hole-2",
          "action-architecture-rabbit-hole-3"
        ],
        "mandatoryEvidenceExpectedRefs": [
          "EV-DELIVERY-AMBIGUITY"
        ],
        "mandatoryEvidencePreservedRefs": [
          "EV-DELIVERY-AMBIGUITY"
        ],
        "matchesExpected": true,
        "measurements": {
          "checkpointEnvelopeBytes": 0,
          "checkpointTokenProxy": 0,
          "ledgerBytes": 3716,
          "telemetryEventBytes": 1850,
          "tokenProxy": 1392,
          "tokens": {
            "availability": "UNAVAILABLE",
            "value": null
          },
          "wallTime": {
            "availability": "UNAVAILABLE",
            "value": null
          }
        },
        "providerCallDelta": -2,
        "providerCalls": 1,
        "scopeExpansionProposalRefs": [],
        "topology": "drift_from_open_decision",
        "traceId": "trace-architecture-rabbit-hole-001",
        "unresolvedGapRefs": [
          "GAP-AUTHZ-CHECK",
          "GAP-COMMIT-HOOK",
          "GAP-DELIVERY-GUARANTEE",
          "GAP-DEPENDENCY-CONTRACT",
          "GAP-RESULT-VISIBILITY"
        ],
        "variant": "ENFORCE_VALID"
      },
      {
        "actualTrajectoryOutcome": "GUARD_DISABLED",
        "caseId": "trace-architecture-rabbit-hole-001:off",
        "checkpointCount": 0,
        "downstreamScopeV2Result": {
          "basePlanCount": 1,
          "conditionalBranchCount": 7,
          "exclusiveAlternativeGroupCount": 3,
          "exclusiveAlternativesNotSummed": true,
          "finalCommittedEstimate": null,
          "relatedFindingCount": 3,
          "requiredEnablerCount": 3,
          "status": "PRESERVED_CAPTURED_SCOPE_V2_RESULT"
        },
        "evidenceCollectedRefs": [
          "EV-DELIVERY-AMBIGUITY"
        ],
        "expectedTrajectoryOutcome": "GUARD_DISABLED",
        "failureBehavior": "GUARD_DISABLED_EXISTING_FLOW",
        "humanUsefulness": "NOT_ASSESSED_DETERMINISTICALLY",
        "irrelevantExplorationAvoidedRefs": [],
        "mandatoryEvidenceExpectedRefs": [
          "EV-DELIVERY-AMBIGUITY"
        ],
        "mandatoryEvidencePreservedRefs": [
          "EV-DELIVERY-AMBIGUITY"
        ],
        "matchesExpected": true,
        "measurements": {
          "checkpointEnvelopeBytes": 0,
          "checkpointTokenProxy": 0,
          "ledgerBytes": 0,
          "telemetryEventBytes": 0,
          "tokenProxy": 0,
          "tokens": {
            "availability": "UNAVAILABLE",
            "value": null
          },
          "wallTime": {
            "availability": "UNAVAILABLE",
            "value": null
          }
        },
        "providerCallDelta": 0,
        "providerCalls": 3,
        "scopeExpansionProposalRefs": [],
        "topology": "drift_from_open_decision",
        "traceId": "trace-architecture-rabbit-hole-001",
        "unresolvedGapRefs": [
          "GAP-AUTHZ-CHECK",
          "GAP-COMMIT-HOOK",
          "GAP-DELIVERY-GUARANTEE",
          "GAP-DEPENDENCY-CONTRACT",
          "GAP-RESULT-VISIBILITY"
        ],
        "variant": "OFF"
      },
      {
        "actualTrajectoryOutcome": "NEEDS_OWNER_REVIEW",
        "caseId": "trace-architecture-rabbit-hole-001:shadow",
        "checkpointCount": 0,
        "downstreamScopeV2Result": {
          "basePlanCount": 1,
          "conditionalBranchCount": 7,
          "exclusiveAlternativeGroupCount": 3,
          "exclusiveAlternativesNotSummed": true,
          "finalCommittedEstimate": null,
          "relatedFindingCount": 3,
          "requiredEnablerCount": 3,